{
    "version": "1.0",
    "data_type": "point_cloud",
    "coordinate_system": "ros",
    "created_at": "2026-02-28T12:00:00",
    "modified_at": "2026-02-28T15:30:00",

    "source": {
        "file_name": "scan.ply",
        "bounds_min": [0.0, 0.0, -0.1],
        "bounds_max": [12.0, 8.0, 3.0]
    },

    "layout": {
        "walls": [
            [[1.159, 1.213, 0.0], [1.159, 4.099, 0.0]],
            [[1.159, 4.099, 0.0], [4.425, 4.099, 0.0]],
            [[4.425, 4.099, 0.0], [4.425, 1.537, 0.0]],
            [[4.425, 1.537, 0.0], [1.159, 1.213, 0.0]]
        ],
        "rooms": [
            {
                "id": "0",
                "type": "bedroom",
                "points": [
                    [7.631, 2.049, 0.0],
                    [7.631, 3.425, 0.0],
                    [11.028, 3.425, 0.0],
                    [11.028, 1.774, 0.0]
                ]
            }
        ]
    },

    "objects": [
        {
            "id": "0",
            "type": "furniture",
            "center": [5.0, 3.0, 0.4],
            "extent": [1.2, 0.8, 0.75],
            "rotation": [1.0, 0.0, 0.0, 0.0]
        },
        {
            "id": "1",
            "type": "appliance",
            "center": [2.5, 2.0, 0.45],
            "extent": [0.6, 0.6, 0.9],
            "rotation": [0.707, 0.0, 0.0, 0.707]
        }
    ],

    "zones": [
        {
            "id": "0",
            "type": "no_go",
            "points": [
                [0.0, 0.0, 0.0],
                [2.0, 0.0, 0.0],
                [2.0, 1.5, 0.0],
                [0.0, 1.5, 0.0]
            ]
        },
        {
            "id": "1",
            "type": "caution",
            "points": [
                [6.0, 1.0, 0.0],
                [8.0, 1.0, 0.0],
                [8.0, 3.0, 0.0]
            ]
        }
    ]
}
